{"$schema":"https://json-schema.org/draft/2020-12/schema","title":"Part Graph","type":"object","required":["schema_version","project_id","parts"],"properties":{"schema_version":{"type":"integer"},"project_id":{"type":"string"},"parts":{"type":"array","items":{"type":"object"}},"interfaces":{"type":"array","items":{"type":"object"}}},"additionalProperties":true}
